{
  "name": "VKATHUSHAN Token List",
  "logoURI": "https://cdn.jsdelivr.net/gh/VKATHUSHAN/crypto-assests@main/evm-usd.png",
  "keywords": [
    "USDT",
    "wrapped",
    "tether",
    "usdox",
    "stablecoin",
    "evm",
    "crypto",
    "ethereum",
    "optimism",
    "binance",
    "bsc"
  ],
  "timestamp": "2025-10-23T20:45:15Z",
  "version": {
    "major": 1,
    "minor": 2,
    "patch": 1
  },
  "tags": {
    "stablecoin": {
      "name": "Stablecoin",
      "description": "Tokens that are fixed to an external asset, e.g. the US dollar"
    },
    "wrapped": {
      "name": "Wrapped",
      "description": "Tokens that represent a wrapped or bridged version of another asset"
    }
  },
  "tokens": [
    {
      "chainId": 1,
      "address": "0xc248d1ea863fdd815df60248f1358dee6e771ec7",
      "name": "Tether USD Coin Wrapped",
      "symbol": "USDT",
      "decimals": 6,
      "logoURI": "https://cdn.jsdelivr.net/gh/VKATHUSHAN/crypto-assests@main/evm-usd.png",
      "tags": [
        "stablecoin",
        "wrapped"
      ]
    },
    {
      "chainId": 1,
      "address": "0x7beb51807e3c8bdb10a2868bd51c2d9e1764925d",
      "name": "Tether USD Wrapped EVM",
      "symbol": "USDT",
      "decimals": 6,
      "logoURI": "https://cdn.jsdelivr.net/gh/VKATHUSHAN/crypto-assests@main/evm-usd.png",
      "tags": [
        "stablecoin",
        "wrapped"
      ]
    },
    {
      "chainId": 10,
      "address": "0x7beb51807e3c8bdb10a2868bd51c2d9e1764925d",
      "name": "Wrapped Tether USD Coin",
      "symbol": "USDT.w",
      "decimals": 18,
      "logoURI": "https://cdn.jsdelivr.net/gh/VKATHUSHAN/crypto-assests@main/evm-usd.png",
      "tags": [
        "stablecoin",
        "wrapped"
      ]
    },
    {
      "chainId": 56,
      "address": "0xf5c470025e99f97a4ca6416c77a685db929e929b",
      "name": "TheUSDOX",
      "symbol": "USDC",
      "decimals": 18,
      "logoURI": "https://cdn.jsdelivr.net/gh/VKATHUSHAN/crypto-assests@main/blockchains/binance-smart-chain/assets/0xf5c470025e99f97a4ca6416c77a685db929e929b/logo.png",
      "tags": [
        "stablecoin"
      ]
    },
    {
      "chainId": 56,
      "address": "0x213e501df9e837d64dcb9f04a63b10b063dbd87d",
      "name": "USDOX Reward",
      "symbol": "rUSDOX",
      "decimals": 18,
      "logoURI": "https://cdn.jsdelivr.net/gh/VKATHUSHAN/crypto-assests@main/blockchains/binance-smart-chain/assets/0x213e501df9e837d64dcb9f04a63b10b063dbd87d/logo.png",
      "tags": [
        "stablecoin"
      ]
    }
  ]
}
